{
  "asset_id": "example-placeholder-asset",
  "placeholder_path": "Assets/Placeholder/Example/ExamplePlaceholder.prefab",
  "replacement_target": "Example runtime avatar or prop",
  "pivot_rule": "Origin anchored at the replacement root.",
  "scale_rule": "1 unit equals 1 meter.",
  "socket_defs": [
    {
      "name": "attach_point",
      "parent": "GameplayAnchors",
      "transform_rule": "Local forward on positive Z."
    }
  ],
  "material_slots": [
    "base"
  ],
  "collision_rule": "Use a single capsule or box collider that matches the gameplay footprint.",
  "prefab_or_node_shape": [
    "Root",
    "VisualRoot",
    "GameplayAnchors"
  ]
}
